,id,original,distorted,article_text,origin_article_text,similarity,source_url,label
1152,45,공화당원들이여 기억하라. 이건 그 누구도 아닌 우리가 했다,"Republicans, remember, this is no one, this is what we did.",It's not crime he's fighting — it's democracy.,Republicans sure do — and they're trying to change the rules so ... It's not crime he's fighting — it's democracy. And he's dangling ...,0.4033004642,https://www.facebook.com/groups/340800184237035/posts/685947443055639/,0
1153,48,바이든을 둘러싼 급진 좌파 광신도들이 대통령직을 빼앗았다,The radical leftist fanatics around him have taken the position of president.,"From left, former President Donald Trump speaking in Dallas; at ...","From left, former President Donald Trump speaking in Dallas; at ... had not unleashed a savage attack on America, and that's what he's done.",0.4175572991,https://www.themarshallproject.org/2024/10/21/fact-check-12000-trump-statements-immigrants,1
1154,52,"모든 항공사, 조종사, 마약 밀매업자, 인신매매범들에게 고한다. 베네수엘라 상공과 주변 공역 전부를 완전히 폐쇄된 것으로 간주하라","All airlines, pilots, drug traffickers, human trafficking agents, consider the airspace and surrounding areas of Venezuela completely closed.",drug dealers and human traffickers should consider the airspace “above and ...,drug dealers and human traffickers should consider the airspace “above and ... airlines that regularly fly over Venezuela airspace ...,0.6840658188,https://www.facebook.com/CBSNews/posts/pres-trump-said-in-a-truth-social-post-on-saturday-that-all-airlines-pilots-drug/1253287469996428/,1
1155,54,"모든 항공사와 조종사, 마약상과 인신매매자들에게 전한다. 부디 베네수엘라의 상공과 주변의 영공 전체를 폐쇄된 것으로 간주하라","All airlines and pilots, drug dealers and human trafficking, please consider the entire airspace in and around Venezuela as closed.","Airlines, Pilots, Drug Dealers, and Human Traffickers, please consider THE AIRSPACE ABOVE AND SURROUNDING VENEZUELA TO BE CLOSED IN ITS ENTIRETY ...","Airlines, Pilots, Drug Dealers, and Human Traffickers, please consider THE AIRSPACE ABOVE AND SURROUNDING VENEZUELA TO BE CLOSED IN ITS ENTIRETY ...",0.957799077,https://www.aljazeera.com/news/2025/11/29/trump-says-venezuela-airspace-to-be-shut-in-its-entirety-as-tensions-rise,0
1156,59,심각해지는 안보 상황과 군사 활동 고조,It's a serious security situation and a high level of military activity.,had potential to be a very serious situation that had national security ...,had potential to be a very serious situation that had national security ... But Maduro has remained in power with support of Venezuela's military ...,0.5128496885,https://usrtk.org/wp-content/uploads/2023/01/FL-2022-00062-September-2022-Production.pdf,0
1157,62,한국의 대미 투자를 지원하는 비자에 대한 영사 인력 추가를 포함해 합법적인 출장을 촉진하고 미국 재산업화에 대한 약속을 이행하고 있다,"We've been promoting legal travel and making promises to re-industrialization in the United States, including additional volunteers to support South Korea's American investment.",lective effort of hundreds of volunteers who have banded together in the spirit of advancing positive change for America.,lective effort of hundreds of volunteers who have banded together in the spirit of advancing positive change for America. Our work is by no ...,0.4531730711,https://static.heritage.org/project2025/2025_MandateForLeadership_FULL.pdf,1
1158,66,저수지 경계 군사분계선에 닿아…韓과 분쟁 요인,"Reservoir border, the military divider... ..and conflict factors.",I argue that a great power chooses its wedge strategies based on two factors: its leverage over its target and the degree of security cooperation between its ...,I argue that a great power chooses its wedge strategies based on two factors: its leverage over its target and the degree of security cooperation between its ...,0.446221292,https://ur.bc.edu/system/files/2025-04/bc-ir109488.pdf,0
1159,68,한국과 분쟁 요인이 될 수 있다,It could be a conflict factor with South Korea.,North Korea's economic dependence on China.,"North Korea's economic dependence on China. Foster-Carter concludes that although North Korea will 'never agree to denuclearise completely', if the US and ...",0.6136787534,https://www.iiss.org/globalassets/media-library---content--migration/files/publications/rsa-2022/aprsa-2022_lr.pdf,0
1160,71,현재 국제 정세가 변화와 혼란이 교차하고 새로운 문제와 도전이 끊임없이 발생하고 있다,The international situation is at a time when change and chaos and new problems and challenges are constantly happening.,So many things are happening at once it's like we are in 1938.,"Ukraine, Taiwan and Iran. So many things are happening at once it's like we are in 1938. Presidents/prime ministers ...",0.5183977485,https://www.reddit.com/r/changemyview/comments/1d2vgik/cmv_we_are_literally_heading_to_ww3_and_its_so/,0
1161,72,중국과 프랑스는 지속적인 대화를 유지하고 전략적 조율을 강화할 필요가 있다,China and France need to maintain constant conversation and reinforce strategic tunes.,The allies have grappled with how to deal with a more assertive China and a nuclear North Korea.,"The allies have grappled with how to deal with a more assertive China and a nuclear North Korea. In recent years, Tokyo and Washington have deepened their ...",0.5621605515,https://www.cfr.org/backgrounder/us-japan-alliance,0
1162,74,다자주의를 수호하고 글로벌 거버넌스 개혁·개선을 위해 새로운 동력을 주입해야 한다,We need to take care of many times and give them new power to reform and improve the global security system.,has provided to Ukraine in security ...,times more than what the U.S. has provided to Ukraine in security ... It's almost an anti-transatlantic schism where you have Prime Minister ...,0.4751726389,https://ua.usembassy.gov/a-s-james-obrien-in-conversation-with-the-german-marshall-fund-of-the-united-states/,1
1163,75,일본 현직 지도자가 대만 관련 도발적 발언을 하며 역사를 역행하려 하고 있다,Japan's current leader is trying to reverse the history of Taiwan's sensational statement.,Moscow has horrified Washington with its plan to ...,"Ukraine's recent record. Moscow has horrified Washington with its plan to ... Japanese Prime Minister Tomiichi Murayama said, last week.",0.4758084416,https://clinton.presidentiallibraries.us/items/show/39461?output=omeka-xml,1
1164,76,이는 중국의 주권과 영토 보전을 침해하는 행위,It's a violation of Chinese sovereignty and territorial integrity.,violated Ukrainian sovereignty and they violated territorial integrity of Ukraine.,violated Ukrainian sovereignty and they violated territorial integrity of Ukraine. China's has changed its ambition to control Taiwan?,0.6351700425,https://www.war.gov/News/Transcripts/Transcript/Article/3220910/secretary-of-defense-lloyd-j-austin-iii-and-army-general-mark-a-milley-chairman/,1
1165,77,중국과 프랑스는 유엔 안보리 상임이사국이자 포괄적 전략적 동반자로서 2차 세계대전 승리 성과를 공동 수호해야 한다,"China and France, as directors of the U.N. Security Council and a comprehensive strategic partner, must jointly protect the success of World War II.","“To Prevent War, NATO Must Spend More”.","“To Prevent War, NATO Must Spend More”. Speech by NATO Secretary General Mark Rutte at the Concert Noble, Brussels.",0.4588747621,https://www.nato.int/en/news-and-events/events/transcripts/2024/12/12/to-prevent-war-nato-must-spend-more,1
1166,80,또한 대만 문제에 대한 중국의 정당한 입장을 이해한다,I also understand the right position in China on the issue of Taiwan.,And you can see that progress in Ukraine's ...,"And you can see that progress in Ukraine's ... You thoroughly answered my question with both Luis and Helene, so I'm going to ask you a question on China, if I ...",0.4617901742,https://www.war.gov/News/Transcripts/Transcript/Article/3220910/secretary-of-defense-lloyd-j-austin-iii-and-army-general-mark-a-milley-chairman/,0
1167,81,"중국과 상호 신뢰를 증진하고 대화·협력을 강화해 글로벌 거버넌스, 경제 불균형 등 도전에 공동 대응하기를 기대한다","We hope to promote mutual trust with China and to strengthen our conversations and cooperation, so that we can work together to meet the challenges of global security, economic imbalances, and so on.","And tomorrow in Havana, to meet with leaders of the G77 [Group of 77 developing countries] and China.","And tomorrow in Havana, to meet with leaders of the G77 [Group of 77 developing countries] and China. But next week begins the greatest G of all ...",0.4007408619,https://press.un.org/en/2023/sgsm21938.doc.htm,0
1168,83,이번 방문이 양국 관계의 고품질 발전을 이끌고 세계 평화와 안정에 기여할 것이라 믿는다,I believe this visit will lead to a higher quality of our relations and contribute to global peace and stability.,met with President Trump once and seemed to have developed a strong relationship.,met with President Trump once and seemed to have developed a strong relationship. Do you think that this will lead to more U.S.,0.5712579489,https://www.state.gov/?%3Bp=92333&post_type=state_briefing,0
1169,84,안정·화해 원천 되길,"We'll make peace. We'll make peace, we'll make peace, we'll make peace.","The Ukrainian president said that, after revisions, the peace plan circulating between Ukraine, Russia, and Washington “looks better” and that work will ...","The Ukrainian president said that, after revisions, the peace plan circulating between Ukraine, Russia, and Washington “looks better” and that work will ...",0.4568511248,https://www.forumulsecuritatiimaritime.ro/ms-daily-brief-en-2/,0
1170,87,우크라이나 전쟁 종식을 위한 최근의 움직임을 예의주시하고 있다,We are watching for recent moves toward the end of the Ukrainian war.,The United States calls on Russia to free all Ukrainians it has wrongfully imprisoned in retaliation for their peaceful dissent and to end Russian abuses of ...,The United States calls on Russia to free all Ukrainians it has wrongfully imprisoned in retaliation for their peaceful dissent and to end Russian abuses of ...,0.5950210094,https://www.state.gov/report/custom/55f5d2c874,0
1171,89,다음 주 미 대표단 러 방문...평화계획 논의 준비,"Next week, we'll discuss the U.S.",discuss possible territorial concessions during his first meeting with Putin later this week.,discuss possible territorial concessions during his first meeting with Putin later this week. US President Donald Trump's summit with Putin ...,0.4032300413,https://www.aljazeera.com/news/liveblog/2025/8/13/live-ukrainian-european-leaders-to-speak-to-trump-before-putin-summit,0
1172,90,미국의 계획을 진지하게 논의할 준비가 끝났다,I'm ready to discuss the American plan seriously.,after the Hungarian prime minister met Vladimir Putin in Moscow ...,after the Hungarian prime minister met Vladimir Putin in Moscow ... plan after US envoy Steve Witkoff has discussed it with Russia next week.,0.4086732566,https://news.sky.com/story/ukraine-war-latest-putin-tells-europe-hes-ready-for-war-after-rejecting-ukraine-peace-deal-as-nato-meets-12541713,0
1173,91,우리는 미국과 전략적 안정성을 기꺼이 논의할 것,We're willing to discuss strategic stability with the United States.,presidents meet at the G20 leaders' summit in Buenos Aires ...,when the Russian and U.S. presidents meet at the G20 leaders' summit in Buenos Aires ... United States in talks on strategic stability ...,0.6650431156,https://carnegieendowment.org/posts/2018/11/what-does-the-kremlin-want-out-of-putin-and-trumps-meeting?lang=en,0
1174,94,푸틴 대통령도 이것이 협상의 좋은 토대라고 인정하고 있으며 우크라이나가 동의하지 못할 만한 내용은 없다,"President Putin also admits that this is a good basis for negotiations, and there's nothing Ukraine does not agree with.",The Kremlin has played down talk of an imminent summit between Russian President Vladimir Putin ...,"The Kremlin has played down talk of an imminent summit between Russian President Vladimir Putin ... Moscow for talks, something Ukraine was ...",0.667173028,https://www.bbc.com/news/articles/cn92e52rpjxo,1
1175,95,미 평화 계획 논의 준비‥다음 주 미 대표단 러 방문,"Ready to discuss the U.S. peace plan... next week, a visit to the United States","""The highly anticipated meeting between myself, as president of the United States of America, and President Vladimir Putin, of Russia, will ...","""The highly anticipated meeting between myself, as president of the United States of America, and President Vladimir Putin, of Russia, will ...",0.5409287214,https://www.npr.org/2025/08/08/nx-s1-5347716/trump-putin-meeting,0
1176,96,미국 대표단이 다음 주 러시아 수도 모스크바를 찾을 예정,"The US delegation is going to find Moscow, Russia, next week.",US President Donald Trump and Russian President Vladimir Putin will meet in Alaska next Friday to discuss the future of the war in Ukraine.,US President Donald Trump and Russian President Vladimir Putin will meet in Alaska next Friday to discuss the future of the war in Ukraine.,0.5500007868,https://www.bbc.com/news/articles/c1dxed639n7o,1
1177,97,우크라이나 사태를 해결하기 위한 미국의 계획을 진지하게 논의할 준비가 끝났다,We're ready to discuss seriously our American plan to solve the situation in Ukraine.,American president will have to address.,American president will have to address. Russia is demanding the US to ...,0.6122881174,https://www.bbc.com/news/live/c3e4xzd8qq8t,0
1178,98,미국과 전략적 안정성을 기꺼이 논의할 것,Be willing to discuss strategic stability with the United States.,This weekend I spoke again with President Putin to make clear that we are ready to keep pursuing high-level diplomacy to reach written ...,This weekend I spoke again with President Putin to make clear that we are ready to keep pursuing high-level diplomacy to reach written ...,0.5470086336,https://bidenwhitehouse.archives.gov/briefing-room/speeches-remarks/2022/02/15/remarks-by-president-biden-providing-an-update-on-russia-and-ukraine/,0
1179,101,"만약 우크라이나군이 그들이 점령한 영토에서 떠난다면 우리는 전투 작전을 멈출 것이고, 그들이 그렇게 하지 않으면 우리는 군사적 수단으로 이를 달성할 것","If the Ukrainians leave the territories they've occupied, we'll stop fighting and if they don't, we'll achieve it by military means.","During the recent Direct Line, when I was asked about Russian-Ukrainian relations, I said that Russians and Ukrainians were one people – a ...","During the recent Direct Line, when I was asked about Russian-Ukrainian relations, I said that Russians and Ukrainians were one people – a ...",0.5235733986,http://en.kremlin.ru/events/president/news/66181,1
1180,105,"일본은 대만 침략과 식민 통치라는 중대 범죄를 깊이 반성하지 않았을 뿐만 아니라, 세계 여론을 무시하고 대만 해협에 군사적으로 개입하려는 망상을 품고 있다","Not only did Japan not deeply reflect on the serious crimes of the invasion of Taiwan and colonial rule, but Japan also has the delusion of military intervention in Taiwan's Strait against global public opinion.",Yuki Watai (University of Warwick).,Is the Cons tu onal Revision Necessary for Japan's 'Proac ve. Yuki Watai (University of Warwick). South Korea and Japan's Policies on Regionalism.,0.5417862535,http://web.isanet.org/Web/Conferences/Toronto%202019-s/Toronto%202019%20-%20Full%20Program.pdf,1
1181,106,"일본이 단 반걸음이라도 선을 넘고 스스로 재앙을 자초한다면, 필연적으로 고통스러운 대가를 치르게 될 것","If Japan takes half a step across the line and brings disaster upon itself, it will inevitably pay a painful price.","In the face of these epoch-making changes, Japan will uphold its ...","In the face of these epoch-making changes, Japan will uphold its ... on the subjects including the protection of Japanese nationals.",0.5029707551,https://www.mofa.go.jp/policy/other/bluebook/2021/pdf/pdfs/2021_all.pdf,1
1182,110,계획 실행 가능…우크라이나 동의 못할 내용 없어,There's nothing in Ukraine that doesn't agree with that.,"the next targets of Putin's expansion attacks if he is victorious in Ukraine (Cameron, 2023; Inskeep ...","the next targets of Putin's expansion attacks if he is victorious in Ukraine (Cameron, 2023; Inskeep ... countries-that-know-russia-best-ukraine- ...",0.5845685005,https://www.insea.org/wp-content/uploads/2023/04/Critical-Identities_InSEA_2024.pdf,1
1183,111,우크라이나 사태를 해결하기 위한 미국 계획을 진지하게 논의할 준비가 끝났다,We're ready to discuss seriously our American plan to solve the situation in Ukraine.,How serious is the U.S.,How serious is the U.S. about investigating Russian war crimes in Ukraine?,0.4661625922,https://www.justice.gov/d9/2023-05/03.10.23.%20--%20Incidents%20With%20Migrants%20and%20USCBP%20-%20Part%201.pdf,1
1184,112,우리도 미국과 전략적 안정성을 기꺼이 논의할 것,We're willing to discuss strategic stability with the United States.,lective in the kinds of cases they are willing to take and also can't ...,"lective in the kinds of cases they are willing to take and also can't ... Africa, and the United States, also discussed capital development ...",0.4027202427,https://www.law.nyu.edu/sites/default/files/NYU_Law_Magazine_2009.pdf,1
1185,118,러시아는 CSTO의 군사 잠재력 강화와 관련된 모든 사안에서 동맹국들과 긴밀히 협력할 것,Russia will work closely with its allies in all its affairs associated with the strengthening of CSTO's military potential.,Share your interactive ePaper on all platforms and on your website with our embed function ...,Share your interactive ePaper on all platforms and on your website with our embed function ... (Russian Academy of Sciences)The Role of the State ...,0.4273045063,https://www.yumpu.com/en/document/view/51158141/new-orleans-2015-full-program,0
1186,4,우리 법은 명료합니다. 불법 명령은 거부할 수 있습니다. 당신은 불법적인 명령을 거부할 수 있습니다.,Our laws are clear. We can reject illegal commands. You can refuse illegal orders.,reading article 92 of the UCMJ in it's entirety will show that it requires members to refuse illegal orders.,reading article 92 of the UCMJ in it's entirety will show that it requires members to refuse illegal orders.,0.6663799286,https://www.facebook.com/georgehtakei/posts/important-message-to-the-military-no-one-is-above-the-law-and-illegal-directives/1391512089013298/,0
1187,9,백악관은 마크 켈리 의원에 대한 국방부의 조사를 지지합니다. 군대에 무질서와 혼란이 있으면 제 기능을 할 수 없습니다.,"The White House supports the National Defense Department's investigation of Senator Mark Kelly, and if there's chaos and chaos in the military, they can't function.","Democrats aren't likely to support the Pentagon plus-up when it's part of the larger party-line package, though.","Democrats aren't likely to support the Pentagon plus-up when it's part of the larger party-line package, though.",0.4314340353,https://www.politico.com/live-updates/2025/04/29/congress/dems-join-gop-to-boost-defense-spending-00317618,1
1188,11,중국과 대화 열려있어,It's open to China.,QUESTION: It's been reported that Indian Prime Minister Modi sets to visit China for the first time in seven years.,QUESTION: It's been reported that Indian Prime Minister Modi sets to visit China for the first time in seven years. And Chinese Foreign Minister ...,0.4748542309,https://www.state.gov/?%3Bp=92333&post_type=state_briefing,0
1189,17,일본은 항상 중국과의 건설적인 대화에 열려 있었습니다. 국익을 극대화하고 대화를 통해 중국과 포괄적이고 좋은 관계를 구축하는 것은 저의 책임입니다.,"Japan has always been open to constructive conversations with China, and it's my responsibility to maximize national interest and build a comprehensive and good relationship with China through dialogue.","In 2016, under the Japanese G7 presidency, Japan hosted the G7 Ise-Shima Summit and the G7 Hiroshima Foreign Ministers' Meeting (See Special Feature “G7 ...","In 2016, under the Japanese G7 presidency, Japan hosted the G7 Ise-Shima Summit and the G7 Hiroshima Foreign Ministers' Meeting (See Special Feature “G7 ...",0.4583089352,https://www.mofa.go.jp/policy/other/bluebook/2017/html/chapter1/c0102.html,0
1190,20,"나이지리아 북부, 사상 최악 기아 위기 직면","Northern Nigeria, facing the worst hunger crisis in history.","Nigeria is suffering complex security crises, but Republicans in US are eager to paint them as purely religious.","Nigeria is suffering complex security crises, but Republicans in US are eager to paint them as purely religious.",0.405726254,https://www.aljazeera.com/news/2025/10/8/ted-cruz-blames-nigeria-for-mass-murder-of-christians-whats-the-truth,1
1191,21,3천500만명 심각한 식량 불안정…1만5천명 기근 수준,"35 million serious food instability... 15,000 famine levels.","Nigeria are pushing hunger to unprecedented levels, with ...","Nigeria are pushing hunger to unprecedented levels, with ... Nearly 35 million people in northern Nigeria are “projected to face severe food insecurity ...",0.6049847007,https://www.instagram.com/p/CfMoM01okEy/,1
1192,22,2026년까지 나이지리아 북부에서 3천500만명이 심각한 식량 불안정에 직면할 것,"By 2026, 35 million people in northern Nigeria will be facing severe food instability.",Food Programme said on Tuesday.,Food Programme said on Tuesday. Nearly 35 million people in northern Nigeria are “projected to face severe food insecurity during the 2026 lean season ...,0.9017182589,https://www.instagram.com/p/CfMoM01okEy/,0
1193,23,나이지리아 북부는 10년 만에 가장 심각한 기아 위기를 겪고 있으며 농촌 농업 공동체가 가장 큰 타격을 입었다,"Northern Nigeria is facing the worst hunger crisis in ten years, and the rural agricultural communities have suffered the most.",Please we need price control on Agriculture input and output that is our major challenge subsistence farmers facing I Nigeria.,Please we need price control on Agriculture input and output that is our major challenge subsistence farmers facing I Nigeria.,0.5602344871,https://www.facebook.com/Atiku.org/posts/farming-is-not-just-an-occupation-for-the-majority-of-the-people-of-nigeria-but-/10158453622249640/,1
1194,26,표백제를 넣으면 음식이 더 안전해지나?,"If you put bleach in, the food's safer?","foods, indicates that all of the currently used dyes should be removed from the food supply and replaced, if at all, by safer colorings."" ""It is ...","foods, indicates that all of the currently used dyes should be removed from the food supply and replaced, if at all, by safer colorings."" ""It is ...",0.5153064728,https://www.facebook.com/foodsciencebabe/posts/but-its-banned-in-europe-does-not-imply-anything-about-the-safety-of-an-ingredie/1133104930847581/,1
1195,36,나이지리아 북부는 10년 만에 가장 심각한 기아 위기를 겪고 있으며 농촌 농업 공동체가 가장 큰 타격을 입었다,"Northern Nigeria is facing the worst hunger crisis in ten years, and the rural agricultural communities have suffered the most.","Africa's most populous country and home to its largest economy, Nigeria has long suffered from internal conflict, and its 2011 polls were ...","Africa's most populous country and home to its largest economy, Nigeria has long suffered from internal conflict, and its 2011 polls were ...",0.5799497366,https://2009-2017.state.gov/documents/organization/243173.pdf,0
1196,38,시 주석이 타이완의 중국 귀속이 전후 국제질서에 있어 중요한 부분이라는 입장을 밝혔다,Mr. President has taken the position that Taiwan's return to China is an important part of the post-war international order.,China's Foreign Ministry said that Xi told Trump that Taiwan's return to ...,China's Foreign Ministry said that Xi told Trump that Taiwan's return to ... China is “an integral part of the postwar international order.” Log ...,0.7695050836,https://www.facebook.com/koco5/posts/trump-and-xi-also-spoke-by-phone-on-monday-to-discuss-trade-taiwan-and-ukraine-c/1269425495214860/,1
1197,40,AI 스타트업은 비용 투자가 커서 단기적 현금 흐름은 악화되지만 잠재시장이 크다,"AI startup has a high cost investment, and the short-term cash flow gets worse, but it's got a lot of potential market.","Manufacting AI is priced in, but alternative designs to cut into NVIDIA's margins is where the potential for making money is.","Manufacting AI is priced in, but alternative designs to cut into NVIDIA's margins is where the potential for making money is.",0.5195189118,https://www.reddit.com/r/investing/comments/1lc8smn/are_you_long_holding_on_nvidia/,1
