,id,original,distorted,article_text,origin_article_text,similarity,source_url,label
766,79,관세 덕에 미국 다시 위대해졌다,The tariff has made America great again.,"President Donald Trump has launched the United States into a trade war, the likes of which has not been seen in decades.","President Donald Trump has launched the United States into a trade war, the likes of which has not been seen in decades. On April 2, 2025 ...",0.5256853104,https://www.americanprogress.org/article/what-will-trumps-tariffs-do-for-u-s-consumers-workers-and-businesses/,1
767,80,관세 덕분에 미국이 다시 위대하고 부유해지고 있다,"Because of the tariff, the United States is becoming great and wealthy again.","Trump's tariffs could cost American households $5,200 annually, but they are unlikely to create jobs, improve U.S.","Trump's tariffs could cost American households $5,200 annually, but they are unlikely to create jobs, improve U.S. economic competitiveness, ...",0.553776443,https://www.americanprogress.org/article/what-will-trumps-tariffs-do-for-u-s-consumers-workers-and-businesses/,1
768,81,관세는 수십년간 미국에 불리한 쪽으로 이용돼 왔다,The tariff has been used against the United States for decades.,"Other countries have used tariffs against us for decades, and now ...","Other countries have used tariffs against us for decades, and now ... you choose, we welcome you into the United States of America.",0.6882294416,https://it.usembassy.gov/remarks-by-president-trump-in-joint-address-to-congress/,1
769,83,이제 흐름은 완전히 바뀌었고 미국은 미국에 불리하게 이용됐던 이런 관세 공격에 성공적으로 대응했다,"Now the tide has changed completely, and the United States has successfully responded to these tariff attacks that have been used against the United States.",So the result of the Trump doctrine in action has been a war on America's allies.,"So the result of the Trump doctrine in action has been a war on America's allies. But the second more important part is: Yes, you'll gain a ...",0.4230979979,https://www.nytimes.com/2025/03/01/opinion/ezra-klein-podcast-fareed-zakaria.html,0
770,85,"만일 우리나라가 '맞불 관세'로 스스로를 보호할 수 없다면, 우리는 생존이나 성공의 기회도 없이 망했을 것","If our country couldn't protect itself with the same tariff, we would have failed without a chance to survive or succeed.",Do you believe Americans can afford higher prices because of tariffs.,Do you believe Americans can afford higher prices because of tariffs. FORMER PRESIDENT DONALD TRUMP: They aren't gonna have higher prices what's gonna have and ...,0.5359653234,https://abcnews.go.com/Politics/harris-trump-presidential-debate-transcript/story?id=113560542,1
771,91,"그들은 어제 오후에 왔고, 매우 좋은 제안을 제시했다",They came yesterday afternoon and offered a very nice offer.,he made his offer alter receiving a tele¬ phone call from Ms Gobold.,he made his offer alter receiving a tele¬ phone call from Ms Gobold. SAME DAY For most large items if you phone before 10am Monday to Friday ...,0.5939747095,https://archive.org/stream/NewsUK1998UKEnglish/Jul%2009%201998%2C%20The%20Times%2C%20%2366249%2C%20UK%20%28en%29_djvu.txt,0
772,105,"트럼프 대통령은 제안을 조금 더 높였고, 그들이 15%의 상호 관세를 받는 것으로 매우 좋은 합의를 이뤘다","President Trump raised the offer a little bit higher, and made a very good deal of their 15 percent mutual tariffs.",President Trump unveiled a battery of new tariffs on Thursday targeting exports from dozens of U.S.,"President Trump unveiled a battery of new tariffs on Thursday targeting exports from dozens of U.S. trading partners, ...",0.6054376364,https://www.nytimes.com/live/2025/07/31/us/trump-news,1
773,106,그들은 상당한 양의 미국산 에너지를 구입할 것이다. 그들은 정부 자원과 민간 기업을 통해 미국에 상당한 규모의 투자를 할 것,They're going to buy a lot of U.S. energy.,They know that's really ...,"that they're going to have to drop their coverage. They know that's really ... DONALD TRUMP, (R) PRESIDENT OF THE UNITED STATES OF AMERICA: Before they get out, I ...",0.4369481802,https://abcnews.go.com/Politics/week-transcript-11-09-25-treasury-secretary-scott/story?id=127340500,1
774,107,트럼프 대통령이 그냥 오케이 사인해 주지 않은 부분이 있다. 그렇게 왔다 갔다 하면서 금액이 올라갔다 내려갔다 하는 과정이 있었다,There's a part that President Trump didn't just sign off.,"As the White House announced earlier this week, the United States is making ...","As the White House announced earlier this week, the United States is making ... As part of this effort, President Trump announced the United ...",0.4608691633,https://www.state.gov/?%3Bp=92333&post_type=state_briefing,0
775,108,"우리는 많은 무역 장벽, 특히 많은 비관세 장벽을 허물었다. 우리는 그들에게 더 많은 에너지를 수출하게 될 것이며, 우리 농민과 모든 수출업체에도 좋을 것","We've denied many trade barriers, especially many non-tax barriers, and we're going to export them more energy, and it's going to be good for our farmers and for all of our exporters.",United States imports more than it exports to those countries — are the result of tariffs and trade barriers that limit U.S.,United States imports more than it exports to those countries — are the result of tariffs and trade barriers that limit U.S.,0.5343626738,https://www.nbcnews.com/business/business-news/live-blog/trump-tariffs-market-reactions-live-updates-rcna199172,1
776,109,한국도 미국 제품을 좋아한다고 말했다,Korea likes American products.,products grew after President Trump announced ...,products grew after President Trump announced ... South Korean President Lee Jae Myung told US Treasury Secretary Scott Bessent that ...,0.514036417,https://finance.yahoo.com/news/live/trump-tariffs-live-updates-trump-unveils-tariffs-on-timber-lumber-furniture-pfizer-set-for-reprieve-175804808.html,0
777,111,"인도는 협상 테이블에 일찍 나왔지만, 지연시켜 왔다. 따라서 대통령과 전체 무역팀은 인도에 실망하고 있다","India came early to the negotiation table, but it was delayed. So the president and the entire trading team are disappointed in India.","Under the leadership of President Trump, American trade ...","Under the leadership of President Trump, American trade ... trade priorities and enforce trade commitments made by America's trading partners ...",0.5093597174,https://ustr.gov/sites/default/files/2019_Trade_Policy_Agenda_and_2018_Annual_Report.pdf,1
778,114,"중국은 90일 관세 유예 시한 연장을 합의했다고 발표했지만, 이는 조금 이르다","China announced that they had agreed to a 90-day delay, but it was a little early.",and North Korea at this time and why they might have said that?,and North Korea at this time and why they might have said that? I recall before President Trump's first term that this idea of ...,0.410297215,https://www.state.gov/?%3Bp=92333&post_type=state_briefing,1
779,117,오늘 제이미슨 그리어 미무역대표부 대표와 함께 8월 12일 시한까지 유예를 시행할지 여부를 트럼프 대통령에게 얘기할 것,Today I'm going to talk to President Trump about whether he's going to postpone it by the end of August 12 with the head of the U.S. Trade Commission for Jamie Greer.,"15, 2017, President Donald Trump held a press conference to discuss an executive order he had signed on infrastr.","15, 2017, President Donald Trump held a press conference to discuss an executive order he had signed on infrastr.",0.5640985966,https://www.politifact.com/article/2019/apr/26/context-trumps-very-fine-people-both-sides-remarks/,1
780,121,합의를 도출하리라고 믿는다,I believe we're going to make an agreement.,"Both of us knew that if we were going to do it, we'd have to do it with as much sincerity as possible, without worrying about the repercussions.","Both of us knew that if we were going to do it, we'd have to do it with as much sincerity as possible, without worrying about the repercussions.",0.4008980989,https://www.printmag.com/wp-content/uploads/2024/06/PR_20140401e-1.pdf,0
781,126,매우 좋은 합의에 도달했다,We have reached a very good agreement.,agree agreeability agreeable agreeableness agreeably agreed agreeing agreement agreements agreement's agreer agreers agrees agrestal agrestic agribusiness ...,agree agreeability agreeable agreeableness agreeably agreed agreeing agreement agreements agreement's agreer agreers agrees agrestal agrestic agribusiness ...,0.5172623396,https://www.eecis.udel.edu/~lliao/cis320f05/dictionary.txt,0
782,132,관세 덕분에 미국이 다시 위대하고 부유해지고 있다,"Because of the tariff, the United States is becoming great and wealthy again.","Trump Tariffs Live Updates: China has warned it is ""not afraid"" of a trade war with the United States, calling instead for dialogue grounded ...","Trump Tariffs Live Updates: China has warned it is ""not afraid"" of a trade war with the United States, calling instead for dialogue grounded ...",0.5437582731,https://timesofindia.indiatimes.com/world/us/donald-trump-tariffs-news-live-updates-xi-jinging-reciprocal-tariffs-us-stock-market-china-canada-india-uk-import-taxes/liveblog/120326091.cms,1
783,154,레바논의 모든 영토에 대해 통치권을 확대할 것,To extend rulership over all territory in Lebanon.,Israeli strike in southern Lebanon while reporting.,Israeli strike in southern Lebanon while reporting. The blast killed ...,0.4105255604,https://www.bbc.co.uk/news/resources/idt-4f79d09b-655a-42f8-82b4-9b2ecebab611,1
784,174,8월 1일부터 15％ 관세 이행 기대,Expect 15% on August 1st.,If Europe were to answer U.S.,"Under the new agreement - entering into force August 1 - almost all EU ... If Europe were to answer U.S. tariffs with, say, a 15-25% tariff on ...",0.4378913343,https://www.ohbev.com/blog/us-wine-market-2024---trends-and-opportunities-and-beyond,1
785,175,미국이 내일부터 합의된 전반적인 15％ 관세 상한을 이행하리라는 것이 EU의 명확한 이해,That the U.S. will carry out the general 15% tariff that has been agreed upon since tomorrow is a clear understanding of the EU.,If we do not have a clear statement in the Bill on what basis ...,If we do not have a clear statement in the Bill on what basis ... The EU has undoubtedly been instrumental in forcing us to clean up our act.,0.6134297252,https://hansard.parliament.uk/commons/2017-09-11/debates/B10868CD-F096-47A2-84EE-A902C8A271BE/EuropeanUnion(Withdrawal)Bill,1
786,179,"그는 연준 의장직을 맡기에 너무 늦고, 사실 너무 화가 나 있고, 멍청하고 정치적","He's too late to take on his senior position, and he's actually so angry, stupid, and political.",He is Trump's VA puppet.,"He is Trump's VA puppet. Michael March 14, 2025 at 16:05.",0.4427360594,https://news.va.gov/138326/va-secretary-doug-collins-veterans-benefits/,1
787,180,그는 건설 역사상 가장 무능하거나 부패한 건물을 개조하는 데 이르렀을 뿐 아니라 우리나라에 수조 달러의 비용이 들게 하고 있다,"Not only has he come to renovate the most incompetent or corrupt building in the history of construction, but he's also costing our country trillions of dollars.","[House Hearing, 118 Congress] [From the U.S.","[House Hearing, 118 Congress] [From the U.S. Government Publishing Office] A LEGACY OF INCOMPETENCE: CONSEQUENCES OF THE BIDEN-HARRIS ADMINISTRATION'S ...",0.4056768417,https://www.congress.gov/event/118th-congress/house-event/LC73236/text,1
788,188,그는 건설 역사상 가장 무능하거나 부패한 건물 리모델링 중 하나뿐 아니라 우리나라에 수조 달러의 비용이 들게 하고 있다,"He's not only remodeling one of the most incompetent or corrupt buildings in the history of construction, but he's also costing our country trillions of dollars.","so, let me see if I have this right.","so, let me see if I have this right. Obama can spend $376 million in taxpayer money to renovate the White House But Trump's donor funded ...",0.5899590254,https://www.facebook.com/groups/fallriverma/posts/3844366415696185/,1
789,192,관세 덕분에 미국 다시 위대하고 부유해지고 있어,The tariff is making America great and rich again.,"In recent weeks, he has made several tariff announcements ...","In recent weeks, he has made several tariff announcements ... Trump is set to hold a press conference, dubbed “Make America Wealthy Again ...",0.6275166869,https://www.aljazeera.com/news/2025/4/1/world-markets-on-edge-as-trump-prepares-for-liberation-day-tariffs,1
790,193,관세 덕분에 미국이 다시 위대하고 부유해지고 있다,"Because of the tariff, the United States is becoming great and wealthy again.","Trump has said the tariffs will be used to boost US manufacturing, saying on Wednesday that the move would ""make America wealthy again"".","Trump has said the tariffs will be used to boost US manufacturing, saying on Wednesday that the move would ""make America wealthy again"".",0.7101037502,https://www.bbc.com/news/articles/cvgql020y5lo,0
791,194,"관세는 수십년간 미국에 불리한 쪽으로 성공적으로 이용돼 왔고 정말 멍청하고 한심하고 부패한 정치인들과 결부돼 우리는 미래와, 심지어 나라의 생존 자체에도 심각한 타격을 입고 있었다","The tariffs have been used successfully against the United States for decades and have been associated with very stupid, pathetic, corrupt politicians, and we've been severely affected by the future, and even by the very survival of our country.","In recent years, the trade deficit led some misguided politicians to call for protectionism, warning that otherwise we would lose jobs.","In recent years, the trade deficit led some misguided politicians to call for protectionism, warning that otherwise we would lose jobs.",0.5590350628,https://www.facebook.com/SimonGerman600/posts/happy-trump-tariffs-day-here-is-a-piece-that-i-consider-essential-reading-global/1268533997968639/,1
792,196,미국이 1년 전 망한 나라였지만 지금은 전 세계에서 가장 성공적인 나라로 거듭났다,"The United States had fallen a year ago, but now it's the most successful country in the world.",that it has maintained arguably the most successful alliance system in history since 1945.,"that it has maintained arguably the most successful alliance system in history since 1945. Now, everybody understood that the United States ...",0.5305947661,https://paulkrugman.substack.com/p/decline-and-fall-of-the-american,1
793,198,한미 간 산업협력이 더 강화되고 한미 동맹도 더 확고해지는 계기가 될 것,The American industrial cooperation will become stronger and the U.S. alliance will become stronger.,Its economy could require cooperation from the United States and its allies to ...,"Its economy could require cooperation from the United States and its allies to ... allies, and why negotiation of restraints could be ...",0.5549812913,https://carnegieendowment.org/research/2024/10/us-china-relations-for-the-2030s-toward-a-realistic-scenario-for-coexistence?lang=en,0
794,199,세계 최대시장인 미국과의 협상은 우리 국민주권 정부의 첫 통상분야 과제였다,"Negotiations with the United States, the world's largest market, were the first common challenge for our national sovereign government.",This Report discusses the largest export markets for the United States ...,This Report discusses the largest export markets for the United States ... does not imply that they are not of concern to the United.,0.5189535618,https://ustr.gov/sites/default/files/files/Press/Reports/2025NTE.pdf,1
795,200,"이번 협상으로 정부는 수출 환경의 불확실성을 없애고, 미국 관세를 주요 대미 수출 경쟁국보다 낮거나 같은 수준으로 맞춤으로써 주요국들과 동등하거나 우월한 조건으로 경쟁할 수 있는 여건을 마련했다","In this negotiations, the government has set up conditions to eliminate the uncertainty of the export environment and to compete on terms equal or superior to the major US exporters by reducing American tariffs to lower or equal levels.",President Donald Trump has made tariffs a cornerstone of his ...,President Donald Trump has made tariffs a cornerstone of his ... negotiate “better conditions” and reach a deal to reduce tariffs.,0.6417863369,https://www.csis.org/analysis/usmca-review-2026,0
796,204,이번 합의는 제조업 재건이라는 미국의 이해와 미국 시장에서 우리 기업들의 경쟁력 확대라는 우리의 의지가 맞닿은 결과,This agreement is based on our understanding of the United States of manufacturing rebuilding and our willingness to increase the competitiveness of our companies in the U.S. market.,"These tariffs will bring jobs back to our districts, strengthen manufacturing ...","These tariffs will bring jobs back to our districts, strengthen manufacturing ... tariffs, they will do business in the United States.",0.4529353976,https://www.whitehouse.gov/articles/2025/04/support-grows-for-president-trumps-america-first-reciprocal-trade-plan/,0
797,219,관세 덕에 미국 다시 위대하고 부유해져,The tariffs make America great and rich again.,One day after President Donald J.,"One day after President Donald J. Trump announced a new chapter in American prosperity, support continues to roll in for his bold vision to ...",0.4818315506,https://www.whitehouse.gov/articles/2025/04/support-grows-for-president-trumps-america-first-reciprocal-trade-plan/,1
798,221,관세 덕분에 미국이 다시 위대하고 부유해지고 있다,"Because of the tariff, the United States is becoming great and wealthy again.","In fact, it has been stated by many that the first month of ...","In fact, it has been stated by many that the first month of ... Tariffs are about making America rich again and making America great again.",0.7178950906,https://www.cnn.com/interactive/2025/03/politics/transcript-speech-trump-congress-annotated-dg/,0
799,223,"이제 조류가 완전히 바뀌었고, 미국은 미국에 불리하게 이용됐던 이런 관세 공세에 성공적으로 맞서고 있다","Now the tide has changed completely, and the U.S. has successfully faced this tariff that has been used against the U.S.",tariffs were actually being played by the guys in the U.S.,tariffs were actually being played by the guys in the U.S. a signature presidential policy like this has been wholly rejected by the ...,0.5740703344,https://carnegieendowment.org/podcasts/the-world-unpacked/trumps-dollar200-billion-tariff-showdown-at-the-supreme-court,0
800,224,미국이 1년 전 망한 나라였지만 지금은 전 세계에서 가장 성공적인 나라로 거듭났다,"The United States had fallen a year ago, but now it's the most successful country in the world.","The United States is stronger, safer, and a richer country than it was when I assumed office less than two years ago.","The United States is stronger, safer, and a richer country than it was when I assumed office less than two years ago. We are standing up for America and for ...",0.5204168558,https://trumpwhitehouse.archives.gov/briefings-statements/remarks-president-trump-73rd-session-united-nations-general-assembly-new-york-ny/,1
801,225,"우리나라가 '맞불 관세'로 스스로를 지킬 수 없다면, 우리는 생존이나 성공의 가능성조차 없이 망할 것","If our country can't protect itself with an equal tariff, we're going to be dead without the possibility of survival or success.",Trump is trying them on industries that just don't really exist much here.,"Trump is trying them on industries that just don't really exist much here. If we import all of a product, putting tariffs doesn't magically ...",0.5545255542,https://www.reddit.com/r/economy/comments/1j4zqfb/can_someone_seriously_elaborate_why_tariffs_are/,1
802,226,우리나라를 구하기 위해 그토록 열심히 싸워온 위대한 내 모든 변호사들에게 오늘 미국의 중대한 소송에서의 행운을 빈다,I wish all my great lawyers who have fought so hard to save our country today good luck in America's major lawsuits.,Have a great week knowing your President is President Trump.,"Have a great week knowing your President is President Trump. Over all, my VA health care has been a good experience.",0.4264825881,https://news.va.gov/138540/va-secretary-addresses-benefits-rumors-video/,1
803,237,한국과 협상서 많은 비관세 무역장벽 철폐,A lot of non-communicative trade barriers to the Republic of Korea.,are growing as Korea's trade account moved into surplus.,are growing as Korea's trade account moved into surplus. This has led the ...,0.5743727684,https://archive.org/stream/FinancialTimes1999UKEnglish/Apr%2028%201999%2C%20Financial%20Times%2C%20%2328%2C%20UK%20%28en%29_djvu.txt,0
804,239,한국과 협상서 많은 비관세 무역장벽 철폐,A lot of non-communicative trade barriers to the Republic of Korea.,Bureaucratic politics and agency interaction with citizens around the world.,Bureaucratic politics and agency interaction with citizens around the world. Protectionism and Political Barriers to Trade.,0.5262029171,https://spsa.net/wp-content/uploads/2023/10/2024-SPSA-Conference-Preliminary-Program-v.-1.0.pdf,0
805,245,다른 말로 하면 파월은 총체적인 실패자이며 우리나라는 대가를 치르고 있다,"In other words, he is a total failure, and our country is paying a price.","For the good of our nation, let's work together, and let's truly make America great again.","For the good of our nation, let's work together, and let's truly make America great again. A hallmark of Trump's politics is that whenever he is ...",0.4198492169,https://www.cnn.com/interactive/2025/03/politics/transcript-speech-trump-congress-annotated-dg/,1
806,246,관세 덕분에 미국이 다시 위대하고 부유해지고 있다,"Because of the tariff, the United States is becoming great and wealthy again.","a free trade agreement, we're now being hit with tariffs.","a free trade agreement, we're now being hit with tariffs. Trump has proven that he should be taken seriously because he's a serious ...",0.5635167956,https://www.state.gov/?%3Bp=92333&post_type=state_briefing,1
807,247,관세는 수십년간 미국에 불리한 쪽으로 성공적으로 이용돼 왔다,The tariff has been successfully used against the United States for decades.,The United States had already completed a free trade agreement (FTA) with ...,The United States had already completed a free trade agreement (FTA) with ... He used tariffs as bargaining leverage throughout the process ...,0.5370616317,https://www.cfr.org/backgrounder/naftas-economic-impact,1
808,249,"이제 조류가 완전히 바뀌었고, 미국은 미국에 불리하게 이용됐던 관세 공세에 성공적으로 맞서고 있다","Now the tide has changed completely, and the U.S. is successfully facing the tariffs that have been used against the U.S.","Earlier Trump had announced that India's tariff rate would be effective August 1, but the Executive order signed for 69 countries - with India ...","Earlier Trump had announced that India's tariff rate would be effective August 1, but the Executive order signed for 69 countries - with India ...",0.4469126463,https://timesofindia.indiatimes.com/business/india-business/donald-trump-tariffs-news-live-updates-india-us-trade-deal-us-tariff-impact-august-1-deadline-russia-penalty-brics/liveblog/123011772.cms,0
809,250,"우리나라가 맞불 관세로 스스로를 지킬 수 없다면, 우리는 생존이나 성공의 가능성조차 없이 망할 것","If our country can't defend itself with a customs tax, we're going to end up with no chance of survival or success.",EFFECTIVE TARIFF RATE RECEDES ON TRADE TRUCE WITH CHINA.,EFFECTIVE TARIFF RATE RECEDES ON TRADE TRUCE WITH CHINA. Customs duty revenue as a percentage of goods imports.,0.4245400429,https://uk.finance.yahoo.com/news/trump-tariffs-live-updates-canada-eu-deal-talks-in-focus-supreme-court-declines-to-speed-up-legal-challenge-200619834.html,1
810,252,관세 덕분에 미국이 다시 위대하고 부유해지고 있다,"Because of the tariff, the United States is becoming great and wealthy again.","By the way, we're gonna have growth in the auto industry ...","By the way, we're gonna have growth in the auto industry ... Tariffs are about making America rich again and making America great again.",0.7178111076,https://www.cnn.com/interactive/2025/03/politics/transcript-speech-trump-congress-annotated-dg/,0
811,253,"관세는 수십 년간 미국에 불리한 쪽으로 이용돼 왔고 정말 멍청하고 한심하고 부패한 정치인들과 결부돼 우리는 미래와, 심지어 나라의 생존 자체에도 심각한 타격을 입고 있었다","The tariffs have been used against the United States for decades and have been associated with politicians who are so stupid and mean and corrupt that we have suffered a severe blow to the future, and even to the very survival of our country.",But here's the thing you need to know that the president of the United States does not: Tariffs supported most of what the federal government did in the 1800s ...,But here's the thing you need to know that the president of the United States does not: Tariffs supported most of what the federal government did in the 1800s ...,0.5808504224,https://newrepublic.com/post/193614/donald-trump-tariffs-dumb-history-income-tax,1
