,id,original,distorted,article_text,origin_article_text,similarity,source_url,label
381,382,"사이버 범죄 퇴치는 캄보디아만의 책임이 아니라, 여러 국가들이 협력해야 하는 국제적 과제","cybercrime eradication is not just a responsibility in Cambodia, but an international challenge that countries have to work with.",The Challenge of International Computer Crime ...,"The Challenge of International Computer Crime ... many commentators have assumed that countries such as China, Korea, and.",0.5657731295,https://papers.ssrn.com/sol3/Delivery.cfm/SSRN_ID304621_code542089.pdf?abstractid=304621&mirid=1,0
382,383,중동에 마침내 평화가 찾아왔다,Peace finally came to us in the Middle East.,Pray that the fighting would come to an end and God would give peace.,"Pray that the fighting would come to an end and God would give peace. Israel, Hamas reach ceasefire deal to end 15 months of war in Gaza.",0.4205603898,https://www.facebook.com/FranklinGraham/posts/im-thankful-to-learn-of-a-ceasefire-and-hostage-deal-between-israel-and-hamas-co/1171204867708439/,0
383,384,내가 천국에 갈 일이 없을 것 같다. 아마 나는 천국행이 아닌 것 같다,I don't think I'm ever going to heaven. Maybe I'm not going to heaven.,I'm being a little cute.,I'm being a little cute. I don't think there's anything going to get me in heaven … I think I'm not maybe heaven-bound.” Donald Trump The ...,0.6241016388,https://www.cnn.com/2025/10/14/politics/trump-israel-hostages-gaza-ceasefire-deal-analysis,0
384,385,지금 우리가 에어포스원을 타고 날아가고 있기 때문에 지금 천국에 있는지도 모른다,I don't even know if we're in heaven right now because we're flying in Air Force One.,end the war in Ukraine because it might help you get into heaven.,end the war in Ukraine because it might help you get into heaven. I may be in heaven right now as we fly on Air Force One.,0.4980603456,https://au.thegospelcoalition.org/article/ten-years-of-trump-misunderstanding-the-gospel/,0
385,386,난 가능하다면 노력해서 천국에 가고 싶다,"I want to try, if I can, to go to heaven.","He said: “If I can save 7 000 people a week from getting killed, that's pretty good.","He said: “If I can save 7 000 people a week from getting killed, that's pretty good. I want to try and get to heaven, if possible ...",0.4785250723,https://au.thegospelcoalition.org/article/ten-years-of-trump-misunderstanding-the-gospel/,0
386,387,하지만 내가 천국에 갈 수 있다면 이게 그 이유 중 하나가 될 것,"But if I could go to heaven, this would be one of the reasons.","But if I can get to heaven, this will be one of the reasons.” “I Don ...","But if I can get to heaven, this will be one of the reasons.” “I Don ... end the war in Ukraine because it might help you get into heaven.",0.5331007242,https://au.thegospelcoalition.org/article/ten-years-of-trump-misunderstanding-the-gospel/,0
387,388,가자 휴전 합의를 끌어내면서 천국에 갈 가능성이 커진 것 같으냐,You think you're more likely to go to heaven with a truce agreement?,let's go and share the gospel—as we've been commanded to.,let's go and share the gospel—as we've been commanded to. I guess you got caught off balance when Trump signed the Peace Treaty in Gaza.,0.4593345225,https://livingwaters.com/the-antichrist-will-he-bring-peace-between-hamas-and-israel/,0
388,389,내가 천국에 갈 일이 없을 것 같다. 아마 나는 천국행이 아닌 것 같다,I don't think I'm ever going to heaven. Maybe I'm not going to heaven.,I don't think there's anything going to get me in heaven.,I don't think there's anything going to get me in heaven. I think I'm not maybe heaven-bound.,0.7392553687,https://au.thegospelcoalition.org/article/ten-years-of-trump-misunderstanding-the-gospel/,0
389,390,우크라이나 전쟁을 끝내 사람들을 구하고 싶다,I want to end the Ukrainian War and save people.,a solid foundation for Ukraine's recovery from the war.,a solid foundation for Ukraine's recovery from the war. President Trump envisioned this partnership between the American people and the ...,0.5573477745,https://www.state.gov/briefings/department-press-briefing-may-1-2025,0
390,391,내가 듣기로 나에 대한 평가가 좋지 않다. 난 정말 밑바닥에 있다. 하지만 내가 천국에 갈 수 있다면 이게 그 이유 중 하나가 될 것,"I'm really at the bottom, but if I could go to heaven, this would be one of the reasons","But if I can get to heaven, this will be one of the reasons.","I am really at the bottom of the totem pole. But if I can get to heaven, this will be one of the reasons.",0.7931815386,https://www.americamagazine.org/faithinfocus/2025/08/20/donald-trump-heaven/,0
391,392,중국에서 기원,Chinese Origin,"china, now in europe!","china, now in europe! yang guo fu blends authentic sichuan ...",0.5288307667,https://www.tiktok.com/@travelfoodie_ishy/video/7438278608495316255,0
392,393,"내 인생, 내 영웅","My life, my hero.","My life, my hero': Gaza hostages reunite with families after two years.","My life, my hero': Gaza hostages reunite with families after two years. One young woman in Gaza tells us about her journey home and her determination to ...",0.5146896839,https://x.com/alice_cuddy,0
393,394,테러 조직,A terrorist organization.,it's a war zone with a terrorist group.,call on Israel to allow these groups to ... it's a war zone with a terrorist group.,0.4263163805,https://www.state.gov/?%3Bp=92333&post_type=state_briefing,0
394,395,우리 아들들이 풀려난 건 기쁘지만 가자지구에서 일어난 모든 파괴와 점령으로 인한 모든 살해로 인해 우린 여전히 고통 받고 있다,"I'm glad our sons have been released, but we're still suffering from all the destruction and slaughter in Gaza.",And 250 violent criminals (murderers and terrorists) were released from Israel including a nice guy who murdered his sister because he thought ...,And 250 violent criminals (murderers and terrorists) were released from Israel including a nice guy who murdered his sister because he thought ...,0.6342012882,https://www.facebook.com/RepMikieSherrill/posts/today-is-an-emotional-day-as-we-see-the-20-living-hostages-reunite-with-their-fa/1212127887391335/,0
395,396,"악몽 끝, 전쟁 종식","End of Nightmare, End of War","Joan Hummer sad, but I agree.","Joan Hummer sad, but I agree. Issac and Ishmael's war, and it'snotgoing to end this way.",0.4174952805,https://www.facebook.com/RepStenyHoyer/posts/i-am-elated-that-all-20-living-hostages-are-now-home-safe-in-the-arms-of-their-f/1382902786538739/,0
396,397,2년 이상 지속된 깊은 고통과 상실을 끝내고 이 지역에 새로운 장을 여는 트럼프 평화협정,"After more than two years of deep pain and loss, the Trump Peace Convention has opened a new chapter in this region.",I feel if anyone can bring peace to the region it is president Trump.,I feel if anyone can bring peace to the region it is president Trump. But history has shown us they have been at war since 1948.,0.6128450632,https://www.facebook.com/SenGaryPeters/posts/im-currently-reviewing-the-terms-of-the-plan-announced-by-president-trump-while-/1375997973890573/,0
397,398,"지속가능한 평화란 팔레스타인인과 이스라엘인 모두가 기본적 인권, 안보, 존엄을 보장 받고 번영하는 것","Sustainable peace is the need for both Palestinians and Israelis to be guaranteed and prosperous in basic human rights, security and dignity.","""We understand that lasting peace will be one in which both Palestinians and Israelis can prosper with their fundamental human rights protected, ...","""We understand that lasting peace will be one in which both Palestinians and Israelis can prosper with their fundamental human rights protected, ...",0.6828676462,https://abcnews.go.com/International/trump-world-leaders-gather-egypt-ceasefire-deal-signing/story?id=126477199,0
398,399,모든 형태의 극단주의와 급진화를 해체,Decomposing all forms of extremism and radical evolution.,"“It's the hideous seed from which hatred grows.” Poignant, but wrong.","“It's the hideous seed from which hatred grows.” Poignant, but wrong. While all forms of racism share a common ancestor in xenophobia, anti-Semitism evolved in ...",0.536346972,https://antisemitism.org.uk/wp-content/uploads/2023/09/6831-Antisem-Op-ed-Doc-v10.pdf,0
399,400,가자지구에서 포괄적·지속적 평화협정을 구축하는 데 이뤄진 진전과 이스라엘과 역내 이웃국들 간 우호적이고 상호 이익이 되는 관계를 환영한다,"Welcome to the development of a comprehensive and lasting peace agreement on Gaza, and a friendly and mutually beneficial relationship between Israel and neighboring countries in the region.",Trump's announcement about the ceasefire in #Gaza and hostage release — it is indeed a big step towards lasting peace for both Israelis and ...,Trump's announcement about the ceasefire in #Gaza and hostage release — it is indeed a big step towards lasting peace for both Israelis and ...,0.7799394131,https://www.facebook.com/WHOEMRO/posts/i-welcome-president-donald-j-trumps-announcement-about-the-ceasefire-in-gaza-and/1979821022656392/,0
400,401,길고 고통스러운 악몽이 드디어 끝났다,"A long, painful nightmare finally ended.",Trump: 'The long and painful nightmare is finally over'.,"Trump: 'The long and painful nightmare is finally over'. as hostages square in Tel Aviv, Israel, Monday, Oct.",0.5820105672,https://www.nbcwashington.com/news/national-international/trump-administration-gaza-israel-hamas-egypt-shutdown-october-13-2025-live-updates/4001044/,0
401,402,이는 전쟁 종식만이 아닌 테러와 죽음의 시대 종식,"This is not just the end of war, but the end of the age of terror and death.","not only the end of a war, this is the end of the age of terror and death.” Using a line that other presidents have reached for — and often ...","not only the end of a war, this is the end of the age of terror and death.” Using a line that other presidents have reached for — and often ...",0.8035990596,https://www.nytimes.com/2025/10/13/world/middleeast/trump-victory-lap-whats-next.html,0
402,403,새 중동의 역사적 새벽,It's a historic dawn in the New Middle East.,"""This is the historic dawn of a new Middle East,"" Trump said in his remarks to the Knesset, Israel's parliament, declaring it at the start of a ...","""This is the historic dawn of a new Middle East,"" Trump said in his remarks to the Knesset, Israel's parliament, declaring it at the start of a ...",0.786323905,https://www.usatoday.com/story/news/politics/2025/10/12/donald-trump-israel-knesset-speech-hostage-prisoner-release/86660929007/,0
403,404,이스라엘은 우리의 도움을 받아 무력으로 할 수 있는 모든 걸 이뤘다. 여러분이 이겼다,"Israel, with our help, has achieved everything you can with the force.",Israel has done that and they're transparent about it.,"Israel has done that and they're transparent about it. So, I mean, that – if you could help us understand what that statement could possibly ...",0.5081378222,https://www.state.gov/?%3Bp=92333&post_type=state_briefing,0
404,405,이제 전장에서 테러리스트에 대해 이룬 이 승리를 중동 전체의 평화와 번영이라는 궁극적 포상으로 전환해야 할 때,"Now that this victory on the battlefield against terrorists has to shift to the ultimate Form of peace and prosperity throughout the Middle East,",victories against terrorists on the battlefield into the ultimate prize of peace and prosperity for the entire Middle East.,victories against terrorists on the battlefield into the ultimate prize of peace and prosperity for the entire Middle East.,0.8011502624,https://6abc.com/post/israel-hamas-hostage-release-families-react-amid-exchange-underway/17996692/,0
405,406,우리 생각엔 이미 시작됐다,We think it's already begun.,We are now faced with a dramatically reshaped Middle East in which Israel ...,"We are now faced with a dramatically reshaped Middle East in which Israel ... It's because, for months, we believe Hamas was waiting for lots of ...",0.4070168436,https://www.presidency.ucsb.edu/documents/press-conference-national-security-advisor-jake-sullivan-tel-aviv-israel,0
406,407,배신자,Traitor.,"""Iran must tighten its grip on every traitor and Mossad collaborator hiding within.","""Iran must tighten its grip on every traitor and Mossad collaborator hiding within. These informers are not just leaking information — they ...",0.4318892956,https://www.facebook.com/trtworld/posts/on-june-13-israel-launched-an-unprovoked-attack-on-multiple-sites-across-iran-in/1174172124745027/,0
407,408,많은 사람들이 1국가 해법을 좋아하고 몇몇은 2국가 해법을 좋아한다,"A lot of people like first-state solutions, some like second-state solutions.","""A lot of people like the one-state solution.","""A lot of people like the one-state solution. Some people like the two-state solution.",0.7861748338,https://www.cbsnews.com/live-updates/israel-hamas-peace-deal-live-updates-hostages-trump-knesset-egypt/,0
408,409,폭격이 멈춘 건 중요하지만 기뻐할 일은 전혀 없다. 내 두 딸은 죽었고 집은 파괴됐고 내 건강은 악화됐다,"It's important that the bombings stop, but there's nothing to be happy about, my two daughters are dead, my house is destroyed, my health is deteriorating.","My two daughters were killed, my home was destroyed and my health has deteriorated.” Momentum for Peace: Trump arrived in Israel today to a ...","My two daughters were killed, my home was destroyed and my health has deteriorated.” Momentum for Peace: Trump arrived in Israel today to a ...",0.6152706146,https://newsnotnoisejessicayellin.substack.com/p/joy-relief-and-the-weight-of-whats?utm_source=substack&utm_medium=email&utm_content=share&action=share,0
409,410,내가 천국에 갈 일이 없을 것 같다. 아마 나는 천국행이 아닌 것 같다.,I don't think I'm ever going to heaven. Maybe I'm not going to heaven.,I don't think there's anything going to get me in heaven.,I don't think there's anything going to get me in heaven. I think I'm not maybe heaven-bound.,0.7392553687,https://au.thegospelcoalition.org/article/ten-years-of-trump-misunderstanding-the-gospel/,0
410,411,지금 우리가 에어포스원을 타고 날아가고 있기 때문에 지금 천국에 있는지도 모른다,I don't even know if we're in heaven right now because we're flying in Air Force One.,I may be in heaven right now as we fly on Air Force One.,I may be in heaven right now as we fly on Air Force One. I'm not sure I'm going to be able to make heaven.” Salvation by Grace.,0.7081916332,https://au.thegospelcoalition.org/article/ten-years-of-trump-misunderstanding-the-gospel/,0
411,412,난 가능하다면 노력해서 천국에 가고 싶다,"I want to try, if I can, to go to heaven.","I want to try and get to heaven, if possible.","I want to try and get to heaven, if possible. I'm hearing I'm not doing well.",0.8063856363,https://au.thegospelcoalition.org/article/ten-years-of-trump-misunderstanding-the-gospel/,0
412,413,내가 듣기로 나에 대한 평가가 좋지 않다. 난 정말 밑바닥에 있다. 하지만 내가 천국에 갈 수 있다면 이게 그 이유 중 하나가 될 것,"I'm really at the bottom, but if I could go to heaven, this would be one of the reasons","But if I can get to heaven, this will be one of the reasons.” ...","I am really at the bottom of the totem pole. But if I can get to heaven, this will be one of the reasons.” ...",0.724368453,https://au.thegospelcoalition.org/article/ten-years-of-trump-misunderstanding-the-gospel/,0
413,414,미국 동맹국들에 미국과 너무 밀착하지 말라는 경고를 보낸 것일 수 있다,It could have been a warning to the United States allies not to get too close to the United States.,Government officials on at least ...,Singer had been previously warned by U.S. Government officials on at least ...,0.4055725932,https://www.bis.doc.gov/index.php/documents/enforcement/1005-don-t-let-this-happen-to-you-1/file,0
414,415,"중국, 韓에도 경고",A warning to China and China.,"government calculus, the United States should also work to monitor Chinese online discussions in a ...","government calculus, the United States should also work to monitor Chinese online discussions in a ... people--I'm thinking of Voice of America.",0.4896551371,https://www.uscc.gov/sites/default/files/transcripts/Hearing%20Transcript_May%2015%202014.pdf,0
415,416,미국 측 조사에 협조,Cooperate with the U.S. Department of Investigation.,"Mueller m, Assistant Attorney General, Criminal Division, U.S..","Mueller m, Assistant Attorney General, Criminal Division, U.S.. Lempres, Executive Associate Commissioner for Operations, U.S..",0.4619998336,https://www.ojp.gov/pdffiles1/Digitization/147409NCJRS.pdf,0
416,417,나는 2주 후 한국에서 열리는 APEC 정상회의에서 시진핑 중국 국가주석을 만날 예정이었지만 이제는 그럴 이유가 없어 보인다,"I'm going to meet the President of China in China at the APEC summit two weeks later in Korea, but I don't think I have any reason to.",when he met with President Xi Jinping at the APEC summit in California.,"when he met with President Xi Jinping at the APEC summit in California. I'm actually going as a tourist to China next week, but I have to ...",0.5355525613,https://china.usembassy-china.org.cn/ambassador-burns-remarks-at-qa-at-the-brookings-institution/,0
417,418,초기의 위협은 단호함을 보여주고 베이징의 과잉행동을 처벌하기 위한 것이었다,The initial threat was to show firmness and punish Beijing for its excesses.,"It has become difficult to imagine how Washington and Beijing might turn their relationship, which is so crucial to the future of world order, toward calmer ...","It has become difficult to imagine how Washington and Beijing might turn their relationship, which is so crucial to the future of world order, toward calmer ...",0.5034855008,https://carnegieendowment.org/research/2024/10/us-china-relations-for-the-2030s-toward-a-realistic-scenario-for-coexistence?lang=en,0
418,419,그 이후의 부드러운 어조는 시장을 안정시키고 동맹국들을 안심시키기 위한 것,The soft tone that follows is to stabilize the market and reassure the allies.,NATO remains the preeminent security Alliance that brings strategic advantage to its members and partners as a force multiplier with strategic ...,NATO remains the preeminent security Alliance that brings strategic advantage to its members and partners as a force multiplier with strategic ...,0.4036625624,https://www.act.nato.int/wp-content/uploads/2024/06/NATO-AC24-Compendium.pdf,0
419,420,세계 제조업에 대한 중국의 지배 강화로 이어지는 개인적 모욕으로 받아들였을 가능성이 높다,It's very likely that he took it as a personal insult to China's rise in control of the world's manufacturing industry.,"for someone like President Trump, it's going to happen very quickly.","for someone like President Trump, it's going to happen very quickly. And China wants to be the most powerful country in the world and they ...",0.5156596899,https://www.state.gov/secretary-marco-rubio-with-megyn-kelly-of-the-megyn-kelly-show,0
420,421,특히 미국 농민들이 무역전쟁의 타격을 체감하기 시작하면서 더욱 그렇다,Especially when American farmers begin to lose their grip on the trade war.,"Turning to trade, President Trump has delivered on his promise to rebalance U.S.","Turning to trade, President Trump has delivered on his promise to rebalance U.S. I'm going to reduce that 50 days that I gave him to a ...",0.4585677087,https://www.state.gov/?%3Bp=92333&post_type=state_briefing,0
421,422,현지 형무소에 한국인 68명 있다고 들어…범죄조직엔 500명 감금,There are 68 Koreans in a local prison... 500 prisoners in a criminal cell.,"North Korea Says Journalists Admitted Crimes,0.","North Korea Says Journalists Admitted Crimes,0. Egyptian treasures found in ...",0.5096793771,https://gist.github.com/amitness/0a2ddbcb61c34eab04bad5a17fd8c86b,0
422,423,위 실장으로부터 형무소에 68명의 한국인이 있다는 얘길 들었다,I heard from the chief of staff that there are 68 Koreans in the prison.,"North Korea Says Journalists Admitted Crimes,0.","North Korea Says Journalists Admitted Crimes,0. Egyptian treasures found in ...",0.4827690721,https://gist.github.com/amitness/0a2ddbcb61c34eab04bad5a17fd8c86b,0
423,424,이스라엘은 무력으로 얻을 수 있는 모든 것을 얻었다,Israel got everything they could by force.,"We know that, again, ...","To say that Israel every time has failed to do that is not true. We know that, again, ...",0.5459976196,https://www.state.gov/?%3Bp=92333&post_type=state_briefing,0
424,425,이제 이 승리를 평화와 번영이라는 궁극적인 성과로 전환할 때,"Now, when we turn this victory into the ultimate achievement of peace and prosperity,",President Trump continues to prove that nations across the globe can move beyond longstanding conflicts of the past toward a shared future of ...,President Trump continues to prove that nations across the globe can move beyond longstanding conflicts of the past toward a shared future of ...,0.5225983858,https://www.state.gov/?%3Bp=92333&post_type=state_briefing,0
425,426,하룻밤에 모든 게 바뀌었다. 트럼프 대통령은 이스라엘이 백악관에서 가진 가장 위대한 친구,President Trump is the greatest friend Israel has in the White House.,Hamas freed the 20 hostages and Israel released some 2000 Palestinian prisoners as part of a cease-fire.,"Hamas freed the 20 hostages and Israel released some 2000 Palestinian prisoners as part of a cease-fire. President Trump, in Israel, ...",0.5717650652,https://www.nytimes.com/live/2025/10/12/world/israel-gaza-hostages-trump,0
426,427,미국 대통령은 중국보다 훨씬 더 많은 카드를 갖고 있지만 그들이 이성적으로 대응할 의향이 있다면 미국도 그렇게 할 것,"The president of the United States has a lot more cards than China, but if they're reasonably willing to respond, the United States will do the same.",What are they going to do when a military-like Russia's or China's attack us?,"What are they going to do when a military-like Russia's or China's attack us? If you don't like what President Trump and DOGE are doing, it's ...",0.4973979294,https://news.va.gov/138326/va-secretary-doug-collins-veterans-benefits/,0
427,428,근본적인 긴장과 불확실성이 여전히 남아 있지만 대화가 진행되는 동안 100% 관세 부과나 파괴적인 수출통제 위험에 대한 우려는 완화될 것으로 보인다,"There's still some fundamental tensions and uncertainty left, but it seems that during the course of the conversation, there will be a relief from the 100% tariff and destructive export control risks.",EFFECTIVE TARIFF RATE RECEDES ON TRADE TRUCE WITH CHINA.,EFFECTIVE TARIFF RATE RECEDES ON TRADE TRUCE WITH CHINA. Customs duty revenue as a percentage of goods imports.,0.5951409936,https://uk.finance.yahoo.com/news/trump-tariffs-live-updates-canada-eu-deal-talks-in-focus-supreme-court-declines-to-speed-up-legal-challenge-200619834.html,0
428,4,러시아의 목표는 변함없다,The goal of Russia has not changed.,Russia currently exhibits some signs of political and economic change.,"Russia currently exhibits some signs of political and economic change. Russia's economic growth has slowed, popular support for Putin has ...",0.5444966555,https://www.congress.gov/crs_external_products/R/PDF/R46518/R46518.6.pdf,0
429,8,우크라이나 분쟁 해결 과정에서 가장 중요한 것은 이 위기를 초래한 근본 원인을 제거하는 것,The most important thing in the course of the Ukrainian conflict resolution is to eliminate the underlying cause of this crisis.,"On 24 February 2022, Russia invaded Ukraine, starting the largest and deadliest war in Europe since World War II.","On 24 February 2022, Russia invaded Ukraine, starting the largest and deadliest war in Europe since World War II. It is a major escalation of the war ...",0.5613245964,https://en.wikipedia.org/wiki/Russo-Ukrainian_war_(2022%E2%80%93present),0
430,9,러시아의 모든 평화 조건은 함께 논의돼야 하고 시간 제한 없이 장기적이고 지속적인 평화의 기반이 돼야 한다,"All the terms of peace in Russia must be discussed together, and it must be a long and lasting basis for peace without time.","Abstract This study explores the designs and dynamics of past, present, and potential mediation and negotiation efforts to stop the Russian ...","Abstract This study explores the designs and dynamics of past, present, and potential mediation and negotiation efforts to stop the Russian ...",0.5960367322,https://brill.com/view/journals/iner/30/1/article-p97_6.xml?language=en,0
431,13,우리는 러시아와 우크라이나가 모두 만족하고 양국 안보를 보장하는 좋은 근본적 기반에서 장기적이고 지속적인 평화가 필요하다,We need long and lasting peace on a good foundation for both Russia and Ukraine to be content and secure.,"Ukraine war: A high-stakes week of hasty diplomacy over a plan to end Russia's war in Ukraine began with the Ukrainian leader, President ...","Ukraine war: A high-stakes week of hasty diplomacy over a plan to end Russia's war in Ukraine began with the Ukrainian leader, President ...",0.6424896121,https://www.nytimes.com/live/2025/12/01/us/trump-news,0
