,id,original,distorted,article_text,origin_article_text,similarity,source_url,label
0,1,조지아 사태 막기위해 외국 전문가 비자 계획중,We're planning a foreign expert visa to stop Georgia from happening.,South Korean battery plant workers detained in Georgia plan to file suitABC News ...,"South Korean battery plant workers detained in Georgia plan to file suitABC News ... Korea's Foreign Ministry, the two countries agreed that ...",0.42469877,https://abcnews.go.com/US/south-korean-workers-us-build-ev-battery-plant/story?id=127339620,0
1,2,"한국 노동자들은 떠났지만, 다시 돌아올 것","Korean workers have left, but they will return.",More than 300 South Korean workers detained following a massive immigration raid at a Hyundai plant in Georgia will be released and brought ...,More than 300 South Korean workers detained following a massive immigration raid at a Hyundai plant in Georgia will be released and brought ...,0.5468484163,https://www.pbs.org/newshour/world/south-korea-reaches-deal-with-u-s-to-return-home-300-workers-detained-in-hyundai-plant-raid,0
2,3,그런 일을 방지하기 위해 미국에 공장을 건설하는 외국 전문가들의 입국을 원활하게 할 계획을 수립하고 있다,"In order to prevent that, we have a plan to make sure that the country is open to foreign professionals who are building factories in the United States.",Noem says roundup of South Korea workers at Hyundai plant won't deter investment in the US ...,Noem says roundup of South Korea workers at Hyundai plant won't deter investment in the US ... South Korea's Foreign Ministry said that officials ...,0.4204480946,https://abc7ny.com/post/south-korea-will-bring-home-300-workers-detained-massive-hyundai-plant-raid-georgia/17770408/,0
3,4,"그러한 단속 방식에는 반대했고, 사실 그들이 미국을 떠나기 전에 이미 상황은 잘 정리되고 있었다","It was against that way of enforcement, and in fact, things were already going well before they left the United States.","illegally, he was a ...","Prada Vasquez was living and working in the U.S. illegally, he was a ...",0.4548409581,https://www.dhs.gov/news/2025/04/30/100-days-fighting-fake-news,0
4,5,"우리는 인식을 같이하고 있고, 다만 이건 한국만이 아닌 전 세계를 대상으로 하는 것","We're sharing our perceptions, but this is not just for Korea, but for the whole world.","In less than one lifetime, South Korea climbed from total devastation to among the wealthiest nations on Earth.","In less than one lifetime, South Korea climbed from total devastation to among the wealthiest nations on Earth. Not just my speech today, but ...",0.6773030758,https://trumpwhitehouse.archives.gov/briefings-statements/remarks-president-trump-national-assembly-republic-korea-seoul-republic-korea/,0
5,6,한국인 노동자들은 떠났지만 다시 돌아올 것,"Korean workers have left, but they will return.",More than 300 South Korean workers detained following a massive immigration raid at a Hyundai plant in Georgia will be released and brought ...,More than 300 South Korean workers detained following a massive immigration raid at a Hyundai plant in Georgia will be released and brought ...,0.5468484163,https://www.pbs.org/newshour/world/south-korea-reaches-deal-with-u-s-to-return-home-300-workers-detained-in-hyundai-plant-raid,0
6,7,복잡한 기계나 장비를 생산하는 경우 초기 단계에는 일부 숙련 인력을 동반해야 한다,"If you're producing complicated machines or equipment, in the early stages, you're going to have to have some skilled hands.","""When they come in, they're making very complex machinery, equipment ...","""When they come in, they're making very complex machinery, equipment ... ""They're going to have to bring some people in, at least at that initial ...",0.5781082511,https://abcnews.go.com/US/south-korean-workers-us-build-ev-battery-plant/story?id=127339620,0
7,8,만나게 되어 매우 기쁘다,I'm so happy to see you.,Brussels has one of the ...,And I am glad to see all you here today. Brussels has one of the ... I'm very happy to see you.,0.6016860008,https://www.nato.int/en/news-and-events/events/transcripts/2024/10/01/press-conference,0
8,9,김정은 북한 국무위원장에게 인사를 전해달라,Kim Jong-un wants me to say hello to the president of the North Korean State Council.,National Intelligence Council ...,North Korea on the U.S. National Intelligence Council ... Getty Images North Korea leader Kim Jong Un and US President Donald Trump shake hands ...,0.7265249491,https://www.bbc.com/news/articles/cd7d2g19q00o,0
9,10,우리는 양국 관계와 발전 전망에 대해 자세히 논의했다,We discussed in detail our relations with each other and our prospects for progress.,I've just had a very important and constructive dialog with my friend.,I've just had a very important and constructive dialog with my friend. It's great to see—I know Laura was ...,0.4158883095,https://www.presidency.ucsb.edu/documents/the-presidents-news-conference-with-president-vladimir-putin-russia-bratislava,0
10,11,북한에서는 베이징에서 열린 회담이 따뜻한 분위기에서 진행된 것에 주목했다,"In North Korea, we noticed that the talks held in Beijing were held in a warm atmosphere.",For Xi — who was flanked by Russian President Vladimir Putin and North Korean strongman Kim Jong Un during a short walk to the ceremonies — the ...,For Xi — who was flanked by Russian President Vladimir Putin and North Korean strongman Kim Jong Un during a short walk to the ceremonies — the ...,0.488627851,https://www.japantimes.co.jp/news/2025/09/03/asia-pacific/politics/china-xi-kim-putin-military-parade-beijing/,0
11,12,우리는 인식을 같이하고 있는데 이건 전 세계를 대상으로 하는 것이지 한국만이 아니다,"We share our perceptions, and this is about the whole world, not just Korea.","TRUMP, President of the United States of America, find that underlying conditions, including a lack of reciprocity in our bilateral ...","TRUMP, President of the United States of America, find that underlying conditions, including a lack of reciprocity in our bilateral ...",0.4316135645,https://www.whitehouse.gov/presidential-actions/2025/04/regulating-imports-with-a-reciprocal-tariff-to-rectify-trade-practices-that-contribute-to-large-and-persistent-annual-united-states-goods-trade-deficits/,0
12,13,"세부 사항이 아주 많고, 매우 복잡한 협정이다. 하지만 거의 마무리 단계에 있다고 생각한다","There's a lot of details, it's a very complicated agreement, but I think it's almost finished.",with the Phase One trade agreement negotiated by the Trump ...,"with the Phase One trade agreement negotiated by the Trump ... In negotiating such an agreement, the United States would ensure that its ...",0.4832596481,https://carnegieendowment.org/research/2024/10/us-china-relations-for-the-2030s-toward-a-realistic-scenario-for-coexistence?lang=en,0
13,14,"지금 논의 중인 것은 미국 내 한국의 투자 방식을 어떤 방식으로 실행하는 게 가장 좋은가, 즉 미국의 이익과 산업 발전에 가장 도움이 되는 방향으로 하는 방법에 관한 것","What we're talking about right now is what's the best way to do the investment in Korea in the U.S., is how to do it in a way that's most helpful for U.S. interests and industrial development?","Follow live updates as President Donald Trump continues his three-country Asia tour with a final stop in South Korea, where he's meeting ...","Follow live updates as President Donald Trump continues his three-country Asia tour with a final stop in South Korea, where he's meeting ...",0.4168549776,https://www.nbcnews.com/politics/donald-trump/live-blog/live-updates-trump-xi-talks-south-korea-asia-tour-trade-third-term-rcna240430,0
14,15,김정은 북한 국무위원장에게 인사를 전해달라,Kim Jong-un wants me to say hello to the president of the North Korean State Council.,Kim Jong Un of North Korea proclaims 'unwavering faith in President Trump.,"Kim Jong Un of North Korea proclaims 'unwavering faith in President Trump. hello to Melania, and while I was there I said hello to Putin.",0.7250310183,https://www.russiamatters.org/analysis/trump-russia-his-own-words,0
15,16,"국가 주권과 영토 안보, 국제적 정의를 수호하는 러시아 지도부의 정책을 변함없이 지지하고 조약을 성실히 이행한다는 게 북한의 대외정책적 입장","It's the foreign policy of North Korea to support the Russian leadership's policy of national sovereignty, territorial security, and international justice, and to carry out the treaty faithfully.",I sincerely hope that North Korea takes the course towards peace and stability while making a right choice to resolve the stress and hardship ...,I sincerely hope that North Korea takes the course towards peace and stability while making a right choice to resolve the stress and hardship ...,0.5313555002,https://obamawhitehouse.archives.gov/the-press-office/2014/04/25/press-conference-president-obama-and-president-park-republic-korea,0
16,17,중국과 합의 가능성 아주 커...내년 초 중국 방문,Very likely a settlement with China... next year's first visit to China.,"REBALANCING TRADE WITH CHINA: This week in the Republic of Korea, President Donald J.","REBALANCING TRADE WITH CHINA: This week in the Republic of Korea, President Donald J. Trump reached a trade and economic deal with President ...",0.5397861004,https://www.whitehouse.gov/fact-sheets/2025/11/fact-sheet-president-donald-j-trump-strikes-deal-on-economic-and-trade-relations-with-china/,0
17,18,"내년 초 중국을 방문하고 그 이후엔 시 주석이 워싱턴이나 팜비치, 또는 다른 장소로 오는 것에 거의 동의했다","I visited China early next year, and after that, he almost agreed to come to Washington or Palm Beach or any other place.","Trump after meeting with President Xi of China, Palm Beach; 7 April 2017.","Trump after meeting with President Xi of China, Palm Beach; 7 April 2017. PRESIDENT TRUMP: I just want to say that President Xi and all of ...",0.5049867034,https://www.jstor.org/stable/44988344,0
18,19,그들은 자신들의 해안에 전 세계에서 가장 위대한 우리의 핵잠수함이 있다는 사실을 알고 있다,They know there's one of our greatest nuclear submarines on their shores all over the world.,The mission had the potential to ...,"nuclear talks with President Trump. The mission had the potential to ... If anything awaited the SEALs on shore, they might not know until it was ...",0.539385438,https://www.nytimes.com/2025/09/05/us/navy-seal-north-korea-trump-2019.html,0
19,20,큰 승리다. 대단한 일이다,It's a great victory. It's a great victory.,And it's people like you and CNN that say things like that.,And we're going to have a great victory. And it's people like you and CNN that say things like that.,0.5150088668,https://trumpwhitehouse.archives.gov/briefings-statements/remarks-president-trump-members-coronavirus-task-force-press-briefing/,0
20,21,밀레이는 미국으로부터 많은 도움을 받았다,Milley got a lot of help from the United States.,"And Chairman Milley, the indictment of former President — U.S.","And Chairman Milley, the indictment of former President — U.S. As you know, the United States will have to provide approval ...",0.4758387208,https://nato.usmission.gov/secretary-of-defense-lloyd-j-austin-iii-and-joint-chiefs-of-staff-chairman-general-mark-a-milley-hold-press-conference-following-udcg/,0
21,22,독일 정부의 재정자극책이 내년에는 추가적인 상승효과를 가져온다,The German government's financial stimulus has an additional boost next year.,"For the coming year, the German government expects ...","For the coming year, the German government expects ... economic stimulus package to strengthen the German economy and combat the consequences of corona.",0.8158051372,https://www.deutschland.de/en/news/german-federal-government-informs-about-the-corona-crisis,0
22,23,양국이 정상 간 중요한 합의를 충실히 이행하고 평등·존중·호혜의 정신을 견지하고 대화를 통해 모순을 해결하고 걸핏하면 압박하는 방식을 버린다면 양국 관계는 안정되게 하고 앞으로 나아가게 할 수 있을 것,"If the two countries faithfully implement important agreements between themselves, and maintain the spirit of equality, respect, and favor through conversation, and then resolve the contradiction, and if they abandon their way of pressing, then the two states will be able to stabilize the relationship and move forward.",The message from Chinese officials has become increasingly clear: the United States and China should first stabilize their political relationship before taking ...,The message from Chinese officials has become increasingly clear: the United States and China should first stabilize their political relationship before taking ...,0.6016725898,https://carnegieendowment.org/research/2024/07/china-nuclear-buildup-political-drivers-united-states-relationship-international-security?lang=en,0
23,24,이는 중미 관계의 가장 소중한 전략적 자산이 됐다,This became the most important strategic asset of the Central American relationship.,"For more than two decades, China has developed close economic and security ties with many Latin American countries, including Brazil, Peru, ...","For more than two decades, China has developed close economic and security ties with many Latin American countries, including Brazil, Peru, ...",0.5292555094,https://www.cfr.org/backgrounder/china-influence-latin-america-argentina-brazil-venezuela-security-energy-bri,0
24,25,최근 중미 간 경제 무역관계에 우여곡절이 있었다,"In recent years, there has been a backlash over inter-U.S. economic trade relations.","An economic conflict between China and the United States has been ongoing since January 2018, when U.S.","An economic conflict between China and the United States has been ongoing since January 2018, when U.S. president Donald Trump began imposing tariffs and ...",0.64201653,https://en.wikipedia.org/wiki/China%E2%80%93United_States_trade_war,0
25,26,쿠알라룸푸르에서 열린 무역회담을 통해 양측은 입장을 명확히 하고 이해를 증진했고 무역 현안을 대등하게 해결하기 위한 프레임워크 합의에 도달했다,"Through the trade talks held in Kuala Lumpur, both sides came to a framework to clarify their position, to enhance their understanding, and to resolve their trade issues in equal terms.","Through the Kuala Lumpur economic and trade talks, the two sides clarified their positions, enhanced mutual understanding, and reached a ...","Through the Kuala Lumpur economic and trade talks, the two sides clarified their positions, enhanced mutual understanding, and reached a ...",0.8178605437,https://sinocism.com/p/latest-us-china-framework-eus-rare,0
26,27,양측이 서로 마주 보고 나아가며 중미 고위급 교류를 잘 준비하고 양국 관계의 발전을 위한 조건을 조성하기를 바란다,"I want both sides to face each other, prepare for the high-end trade in Central America and provide conditions for the development of the two states.","U.S.-China economic relations can be divided into three areas: first, relative economic scale, which is the most relevant for global geopolitics ...","U.S.-China economic relations can be divided into three areas: first, relative economic scale, which is the most relevant for global geopolitics ...",0.4546182156,https://carnegieendowment.org/research/2024/10/us-china-relations-for-the-2030s-toward-a-realistic-scenario-for-coexistence?lang=en,0
27,28,일본의 대미투자 과반은 전력·에너지,Japan's U.S. investment over half of its electricity.,Secretary of Commerce Howard Rutnick said on the same day that more than half of Japan's $550 billion (about 788 trillion won) investment ...,Secretary of Commerce Howard Rutnick said on the same day that more than half of Japan's $550 billion (about 788 trillion won) investment ...,0.5550850034,https://www.mk.co.kr/en/world/11453051,0
28,29,일본과 미국의 경제안보를 위한 공동 투자,A joint investment in economic security for Japan and the United States.,President Donald Trump will direct the investments and the projects funded by Japan will be controlled by the United States.,President Donald Trump will direct the investments and the projects funded by Japan will be controlled by the United States.,0.6917082071,https://www.japantimes.co.jp/business/2025/09/05/economy/550-billion-mou/,1
29,30,"거대 사업이지만, 일본이 참여하면 LNG를 인수할 권리를 얻어 에너지 측면에서 자립할 수 있다","It's a big business, but if Japan gets involved, they have the right to take over the LNG, and they can support themselves in terms of energy.","Minister Rutnick not only made Korea's participation a fait accompli, but also said about Japan, ""Alaska LNG development project will also be a ...","Minister Rutnick not only made Korea's participation a fait accompli, but also said about Japan, ""Alaska LNG development project will also be a ...",0.5823714733,https://www.mk.co.kr/en/economy/11456156,0
30,31,미국에 공장짓는 외국전문가 위한 새 비자계획 수립중,I'm working on a new visa project for a foreign expert who's built a factory in the United States.,Trump says he wants foreign investment in manufacturing.,Trump says he wants foreign investment in manufacturing. This is an odd way of showing it.,0.4105105698,https://www.reddit.com/r/energy/comments/1ncrozb/the_ice_raid_on_the_georgia_hyundai_battery_plant/,0
31,32,우리는 인식을 같이하고 있는데 이건 전 세계를 대상으로 하는 것이지 한국만이 아니다,"We share our perceptions, and this is about the whole world, not just Korea.","Funny, Netouyo anime otaku Japanese say that but the fact is Japan is a war criminal nation conquered by U.S.","Funny, Netouyo anime otaku Japanese say that but the fact is Japan is a war criminal nation conquered by U.S. while S.Korea is blood ally of ...",0.5036987662,https://www.facebook.com/time/posts/korean-people-have-an-indomitable-will-although-there-are-many-difficulties-in-f/1164052228914108/,0
32,33,미중 관계 여러 굴곡…무역 협상서 상호 이해 심화,The middle-class ties... trade negotiations... deepening mutual understanding.,deepen economic cooperation with China while maintaining security ties to the United States.,"deepen economic cooperation with China while maintaining security ties to the United States. policy, and expressing optimism about ...",0.6612231731,https://carnegieendowment.org/research/2025/05/the-transformation-of-south-korean-progressive-foreign-policy?lang=en,0
33,34,시 주석과 트럼프 대통령은 오랜 기간 교류를 이어 왔고 서로를 존중해 왔다,President Kim and President Trump have been interacting for a long time and have respected each other.,It's unclear whether Trump was quoting the Chinese president or had misunderstood what he was told when he said Korea had been part of China ...,It's unclear whether Trump was quoting the Chinese president or had misunderstood what he was told when he said Korea had been part of China ...,0.5573496819,https://www.nbcwashington.com/news/national-international/how-one-trump-comments-angered-south-korea-ap-explains/2051905/,0
34,35,미중 간 무역·경제 관계는 여러 굴곡을 겪어 왔다,U.S. trade/economic relations have been through a lot of cave-ins.,China's gross (including re‐exports) foreign trade.,"During the treaty port era, Shanghai handled about 50% of. China's gross (including re‐exports) foreign trade. In this paper, we introduce a formal historical ...",0.4986077249,https://www.nber.org/system/files/working_papers/w17754/w17754.pdf,0
35,36,중국이 희토류 수출 제한 계획을 추진할 경우 트럼프 대통령이 부과하겠다고 위협했던 100% 관세 부과를 피했다,"If China's plan to limit its exports, he avoided the 100 percent tariffs that President Trump threatened to pay.","During his first term as President of the United States, Donald Trump enacted a series of tariffs involving protectionist trade initiatives against other ...","During his first term as President of the United States, Donald Trump enacted a series of tariffs involving protectionist trade initiatives against other ...",0.5619730353,https://en.wikipedia.org/wiki/Tariffs_in_the_first_Trump_administration,0
36,37,미국과 중국이 무역 합의를 이끌어내게 될 것,The U.S. and China will lead to a trade agreement.,take collective action in responding to China should they believe the terms of the contracts are unfair.,take collective action in responding to China should they believe the terms of the contracts are unfair. What is clear is that China's trade ...,0.5439212918,https://www.cfr.org/task-force-report/chinas-belt-and-road-implications-for-the-united-states/findings,0
37,38,미국에 공장짓는 외국전문가 위한 새 비자계획 수립중,I'm working on a new visa project for a foreign expert who's built a factory in the United States.,immigration enforcement action at a Hyundai manufacturing plant in Georgia.,immigration enforcement action at a Hyundai manufacturing plant in Georgia. and arrested almost 300 highly skilled-visa Korean workers ...,0.4290209115,https://www.facebook.com/groups/390487464773258/posts/1960302447791744/,0
38,39,우리는 인식을 같이하고 있는데 이건 전 세계를 대상으로 하는 것이지 한국만이 아니다,"We share our perceptions, and this is about the whole world, not just Korea.",President Trump continues to prove that nations across the globe can move beyond longstanding conflicts of the past toward a shared future of ...,President Trump continues to prove that nations across the globe can move beyond longstanding conflicts of the past toward a shared future of ...,0.4356589019,https://www.state.gov/?%3Bp=92333&post_type=state_briefing,0
39,40,캐나다 당분간 만나지 않을 것,I won't see you in Canada for a while.,OCR: < Top Stories #CBCNEWS BREAKING Trump says he's terminating trade negotiations with Canada over Ontario anti-tariffad tariff ad In a ...,OCR: < Top Stories #CBCNEWS BREAKING Trump says he's terminating trade negotiations with Canada over Ontario anti-tariffad tariff ad In a ...,0.4043666422,https://www.facebook.com/groups/336421063935440/posts/1848811329363065/,0
40,41,APEC 정상회의 기간 카니 총리와 만나고 싶지 않다,I don't want to meet with Prime Minister Carney during the APEC summit.,The entire point is that if you don't want the millions of ...,The entire point is that if you don't want the millions of ... Trump also said Monday he won't be meeting with Canadian Prime Minister Mark Carney ...,0.548735261,https://www.facebook.com/JakeTapper/posts/canadian-official-on-anti-tariff-ad-that-irked-trump-mission-accomplishedwatch-t/1370049287823019/,0
41,42,현재 캐나다와 맺은 합의에 매우 행복하다며 그냥 내버려 두겠다고 강경한 입장을 유지했습니다.앞서 트럼프는 캐나다 온타리오주가 로널드 레이건 전 대통령이 등장하는 관세 반대 광고를 했다며 지난 23일 캐나다와의 무역 협상을 중단한다고 발표했습니다.파장이 커지자 다음날 온타리오주는 문제가 된 광고를 하지 않겠다고 밝혔지만 트럼프 대통령은 잘못을 알고도 광고를 바로 중단하지 않았다면서 캐나다에 관세 10% 추가 인상을 선언했습니다.트럼프 대통령의 무역 협상 재개 가능성 일축에도 불구하고 캐나다는 미국과의 무역 대화를 언제든 다시 하겠다는 입장을 거듭 밝혔습니다.카니 총리는 아세안 정상회의에서 기자들을 만나,"In spite of the fact that he is now very happy to make a deal with Canada, he has taken a strong stand that he's going to let go of it.",OCR: < Top Stories #CBCNEWS BREAKING Trump says he's terminating trade negotiations with Canada over Ontario anti-tariffad tariff ad In a ...,OCR: < Top Stories #CBCNEWS BREAKING Trump says he's terminating trade negotiations with Canada over Ontario anti-tariffad tariff ad In a ...,0.5460422039,https://www.facebook.com/groups/336421063935440/posts/1848811329363065/,0
42,43,고 말했다고 외신들은 전했습니다.카니 총리는,"Prime Minister Carney said,","He now finds himself facing a different political foe, new Liberal leader and Prime Minister Mark Carney.","He now finds himself facing a different political foe, new Liberal leader and Prime Minister Mark Carney. While Poilievre's Conservatives have ...",0.63608706,https://www.bbc.com/news/articles/c9dpde9dxp0o,0
43,44,다시 만나 영광,It's a pleasure to see you again.,"of time, and it's an honor to have you with us.” 5d ago / 10:13 ...","of time, and it's an honor to have you with us.” 5d ago / 10:13 ... with Trump telling Xi it was “good to see you again.” “We're going ...",0.5521265864,https://www.nbcnews.com/politics/donald-trump/live-blog/live-updates-trump-xi-talks-south-korea-asia-tour-trade-third-term-rcna240430,0
44,45,매우 좋은 회담이 될 것으로 기대한다,I expect it to be a very good meeting.,"Treasury Secretary Scott Bessent told ABC's “This Week” that he anticipated a “fantastic meeting” between President Trump and Xi Jinping, ...","Treasury Secretary Scott Bessent told ABC's “This Week” that he anticipated a “fantastic meeting” between President Trump and Xi Jinping, ...",0.4528165162,https://www.nytimes.com/live/2025/10/26/us/trump-news,0
